{
  "$schema": "../../../../schemas/utility-manifest.schema.json",
  "name": "Pointer utilities",
  "key": "pointer",
  "description": "Dictates styling and available actions for visible cursors and pointer/touch actions.",
  "layer": "utilities",
  "families": [
    {
      "name": "cursor",
      "description": "Sets the visual display of the cursor icon.",
      "guidance": [
        "Use the appropriate contextual cursor when it provides meaningful information to the end user. 'Pointer' for when the cursor is above interactive (clickable) elements, 'not-allowed' when the element is in a disabled state, 'grab' when an element is draggable, etc. Hyper specific cursors like 'vertical-text' or 'copy' are not necessary - use 'pointer' for a copy button and the default cursor for an input element or when hovering over text content instead."
      ],
      "source": "src/core/styles/utility-classes/pointer.scss.scss",
      "properties": [
        "cursor"
      ],
      "pattern": {
        "base": "cursor",
        "values": [
          "auto",
          "default",
          "pointer",
          "wait",
          "text",
          "move",
          "help",
          "not-allowed",
          "none",
          "context-menu",
          "progress",
          "cell",
          "crosshair",
          "vertical-text",
          "alias",
          "copy",
          "no-drop",
          "grab",
          "grabbing",
          "all-scroll",
          "col-resize",
          "row-resize",
          "n-resize",
          "e-resize",
          "s-resize",
          "w-resize",
          "ne-resize",
          "nw-resize",
          "se-resize",
          "sw-resize",
          "ew-resize",
          "ns-resize",
          "nesw-resize",
          "nwse-resize",
          "zoom-in",
          "zoom-out"
        ]
      }
    },
    {
      "name": "pointer-events",
      "description": "Determines the interactivy level of content when hovered over with a mouse.",
      "guidance": [
        "Use 'none' if you need an overlay or icon to not block element interactivity behind it."
      ],
      "source": "src/core/styles/utility-classes/pointer.scss.scss",
      "properties": [
        "pointer-events"
      ],
      "pattern": {
        "base": "pointer-events",
        "values": [
          "auto",
          "none"
        ]
      }
    },
    {
      "name": "user-select",
      "description": "Controls whether users can select text within an element.",
      "guidance": [
        "Use 'none' on interactive items with text within them to prevent touch interaction from triggering text selection if pressed for too long. Use 'all' for bodies of copy (like a code block) that a user would conceivably want to select and copy in a full chunk."
      ],
      "source": "src/core/styles/utility-classes/pointer.scss.scss",
      "properties": [
        "user-select"
      ],
      "pattern": {
        "base": "user-select",
        "values": [
          "auto",
          "none",
          "text",
          "all"
        ]
      }
    },
    {
      "name": "touch-action",
      "description": "Determines how the browser manages default touchscreen gestures (like panning, scrolling, and zooming) over a specific element",
      "guidance": [
        "Be wary of overusing 'none' or applying it on elements like <body> as it will disable zoom ability for users who may need it for accessibility reasons."
      ],
      "source": "src/core/styles/utility-classes/pointer.scss.scss",
      "properties": [
        "touch-action"
      ],
      "pattern": {
        "base": "touch-action",
        "values": [
          "auto",
          "none",
          "pan-x",
          "pan-y",
          "pan-left",
          "pan-right",
          "pan-up",
          "pan-down",
          "pinch-zoom",
          "manipulation"
        ]
      }
    }
  ]
}