{
  "$schema": "../../../../schemas/utility-manifest.schema.json",
  "name": "Cursor utilities",
  "key": "cursor",
  "description": "Dictates styling and available actions for visible cursors and pointer/touch actions.",
  "layer": "utilities",
  "families": [
    {
      "name": "cursor",
      "description": "Sets the visual display of the cursor icon.",
      "guidance": [
        "Use the appropriate contextual cursor when it provides meaningful information to the end user. 'Pointer' for when the cursor is above interactive (clickable) elements, 'not-allowed' when the element is in a disabled state, 'grab' when an element is draggable, etc. Hyper specific cursors like 'vertical-text' or 'copy' are not necessary - use 'pointer' for a copy button and the default cursor for an input element or when hovering over text content instead."
      ],
      "source": "src/core/styles/utilities/_cursor.scss",
      "properties": [
        "cursor"
      ],
      "pattern": {
        "base": "cursor",
        "values": [
          "auto",
          "default",
          "pointer",
          "wait",
          "text",
          "move",
          "help",
          "not-allowed",
          "none",
          "context-menu",
          "progress",
          "cell",
          "crosshair",
          "vertical-text",
          "alias",
          "copy",
          "no-drop",
          "grab",
          "grabbing",
          "all-scroll",
          "col-resize",
          "row-resize",
          "n-resize",
          "e-resize",
          "s-resize",
          "w-resize",
          "ne-resize",
          "nw-resize",
          "se-resize",
          "sw-resize",
          "ew-resize",
          "ns-resize",
          "nesw-resize",
          "nwse-resize",
          "zoom-in",
          "zoom-out"
        ]
      }
    }
  ]
}